{
  "$schema": "http://json-schema.org/draft-07/schema#",
  "$id": "work.schema.json",
  "title": "Canonical Work",
  "description": "A single work (book, article, pamphlet…) in the Atlas library. Canonical data shared across all themes that reference it.",
  "type": "object",
  "required": ["id", "title", "author_ids", "year", "kind", "source"],
  "additionalProperties": false,
  "properties": {
    "id": {
      "type": "string",
      "pattern": "^[a-z0-9-]+$",
      "description": "Unique slug identifier for this work"
    },
    "title": {
      "type": "string",
      "minLength": 1
    },
    "author_ids": {
      "type": "array",
      "items": { "type": "string", "pattern": "^[a-z0-9-]+$" },
      "minItems": 1
    },
    "year": {
      "type": "integer",
      "minimum": 1800,
      "maximum": 2100
    },
    "kind": {
      "type": "string",
      "enum": ["article", "chapter", "book", "pamphlet", "speech", "letter"]
    },
    "source": {
      "type": "object",
      "required": ["url", "provider"],
      "additionalProperties": false,
      "properties": {
        "url": { "type": "string", "format": "uri" },
        "provider": { "type": "string" },
        "attribution_label": { "type": "string" }
      }
    },
    "study_guide": {
      "type": "object",
      "additionalProperties": false,
      "properties": {
        "hook": { "type": "string" },
        "historical_context": { "type": "string" },
        "responds_to": {
          "type": "array",
          "items": {
            "type": "object",
            "required": ["label", "why_it_matters"],
            "additionalProperties": false,
            "properties": {
              "label": { "type": "string" },
              "why_it_matters": { "type": "string" }
            }
          }
        },
        "reading_entry": {
          "type": "object",
          "additionalProperties": false,
          "properties": {
            "start_here": {
              "type": "object",
              "required": ["label", "why"],
              "additionalProperties": false,
              "properties": {
                "label": { "type": "string" },
                "why": { "type": "string" }
              }
            },
            "key_sections": {
              "type": "array",
              "items": {
                "type": "object",
                "required": ["label", "why"],
                "additionalProperties": false,
                "properties": {
                  "label": { "type": "string" },
                  "why": { "type": "string" }
                }
              }
            },
            "focus_points": {
              "type": "array",
              "items": { "type": "string" }
            },
            "if_short_on_time": {
              "type": "array",
              "items": { "type": "string" }
            }
          }
        },
        "timeline": {
          "type": "array",
          "items": {
            "type": "object",
            "required": ["year", "kind", "label"],
            "additionalProperties": false,
            "properties": {
              "year": { "type": "integer", "minimum": 1800, "maximum": 2100 },
              "kind": { "type": "string", "enum": ["writing", "publication", "context", "reception"] },
              "label": { "type": "string" },
              "note": { "type": "string" }
            }
          }
        },
        "criticisms": {
          "type": "array",
          "items": {
            "type": "object",
            "required": ["from", "claim"],
            "additionalProperties": false,
            "properties": {
              "from": { "type": "string" },
              "claim": { "type": "string" },
              "note": { "type": "string" },
              "related_work_id": { "type": "string", "pattern": "^[a-z0-9-]+$" }
            }
          }
        },
        "legacy": { "type": "string" },
        "questions_opened": {
          "type": "array",
          "items": { "type": "string" }
        }
      }
    }
  }
}
