{
  "id": "alemania-clave-situacion-internacional",
  "title": "Alemania, la clave de la situación internacional",
  "author_ids": [
    "trotsky-leon"
  ],
  "year": 1931,
  "kind": "article",
  "source": {
    "provider": "Marxists.org",
    "url": "https://www.marxists.org/espanol/trotsky/indice.htm",
    "attribution_label": "Trotsky, León. Escritos sobre Alemania (1930-33). Marxists.org."
  }
}