{
  "id": "lenin-imperialism-highest-stage",
  "title": "Imperialism, the Highest Stage of Capitalism",
  "author_ids": [
    "lenin-vi"
  ],
  "year": 1916,
  "kind": "pamphlet",
  "source": {
    "provider": "Marxists Internet Archive",
    "url": "https://www.marxists.org/archive/lenin/works/1916/imp-hsc/",
    "attribution_label": "Lenin, Imperialism, the Highest Stage of Capitalism (Marxists.org)"
  }
}