{
  "id": "salario-precio-ganancia",
  "title": "Salario, precio y ganancia",
  "author_ids": [
    "marx-karl"
  ],
  "year": 1865,
  "kind": "speech",
  "source": {
    "provider": "Marxists.org",
    "url": "https://www.marxists.org/espanol/m-e/1860s/65-salar.htm",
    "attribution_label": "Karl Marx (1865). Marxists Internet Archive."
  },
  "study_guide": {
    "hook": "Texto corto y muy pedagógico donde Marx entra al debate sindical para explicar por qué la lucha salarial importa y, al mismo tiempo, por qué no basta.",
    "historical_context": "Presentado ante la Asociación Internacional de Trabajadores en 1865, responde a discusiones concretas sobre salarios, precios y sentido de la acción sindical.",
    "responds_to": [
      {
        "label": "La idea de que subir salarios solo hace subir precios",
        "why_it_matters": "Marx desmonta ese argumento para defender la legitimidad de la lucha obrera inmediata."
      },
      {
        "label": "La reducción del conflicto obrero a gestión salarial",
        "why_it_matters": "El texto muestra que la lucha económica es necesaria, pero debe abrir a una crítica del sistema salarial en su conjunto."
      }
    ],
    "reading_entry": {
      "start_here": {
        "label": "Empieza por la polémica sobre salarios y precios, y luego ve a los pasajes sobre plusvalor.",
        "why": "Es la secuencia más pedagógica: primero desmonta una objeción sindical inmediata y después abre la lógica general de la explotación."
      },
      "key_sections": [
        {
          "label": "Los pasajes contra la idea de que subir salarios sube automáticamente precios",
          "why": "Son la puerta de entrada más clara y concreta del texto."
        },
        {
          "label": "La explicación de plusvalor y trabajo asalariado",
          "why": "Ahí se ve por qué la lucha económica remite a una crítica más amplia del capital."
        }
      ],
      "focus_points": [
        "Fíjate en el tono de intervención militante: Marx está argumentando ante obreros organizados.",
        "No te quedes en la defensa sindical; mira cómo el texto empuja más allá del salario."
      ],
      "if_short_on_time": [
        "Lee primero la refutación del argumento precios-salarios.",
        "Vuelve luego a los pasajes donde Marx define valor de la fuerza de trabajo y plusvalor."
      ]
    },
    "timeline": [
      {
        "year": 1865,
        "kind": "writing",
        "label": "Marx expone la argumentación ante la Internacional",
        "note": "Su tono didáctico responde a un debate militante y no a un tratado académico."
      },
      {
        "year": 1867,
        "kind": "reception",
        "label": "Se relee a la luz de El Capital",
        "note": "Muchos de sus argumentos funcionan como puerta de entrada condensada a problemas luego desarrollados con más extensión."
      }
    ],
    "criticisms": [
      {
        "from": "Lecturas economicistas",
        "claim": "Se ha usado el texto para quedarse en la defensa sindical y perder el salto hacia la crítica del trabajo asalariado."
      }
    ],
    "legacy": "Sigue siendo probablemente la entrada más clara para empezar a estudiar plusvalor, salario y límites de la lucha puramente económica.",
    "questions_opened": [
      "¿Por qué la lucha salarial es necesaria pero insuficiente?",
      "¿Cómo se conecta la defensa inmediata con la abolición del trabajo asalariado?"
    ]
  }
}
