{
  "id": "engels-socialismo-cientifico",
  "title": "Del socialismo utópico al socialismo científico",
  "author_ids": [
    "engels-friedrich"
  ],
  "year": 1880,
  "kind": "pamphlet",
  "source": {
    "provider": "Marxists.org",
    "url": "https://www.marxists.org/espanol/e-m/1880s/utopico/index.htm",
    "attribution_label": "Engels, Friedrich. Del socialismo utópico al socialismo científico (1880). Marxists.org."
  }
}
