{
  "id": "critica-programa-gotha",
  "title": "Crítica del Programa de Gotha",
  "author_ids": [
    "marx-karl"
  ],
  "year": 1875,
  "kind": "pamphlet",
  "source": {
    "provider": "Marxists.org",
    "url": "https://www.marxists.org/espanol/m-e/1870s/gotha.htm",
    "attribution_label": "Marx, Karl. Crítica del Programa de Gotha (1875). Marxists.org."
  }
}
