{
  "id": "que-es-fascismo-trotsky",
  "title": "¿Qué es el fascismo?",
  "author_ids": [
    "trotsky-leon"
  ],
  "year": 1931,
  "kind": "article",
  "source": {
    "provider": "Marxists.org",
    "url": "https://www.marxists.org/espanol/trotsky/ceip/escritos/libro2/T02V234.htm",
    "attribution_label": "Trotsky, León. ¿Qué es el fascismo? (1931). Marxists.org."
  }
}