{
  "id": "engels-condition-working-class",
  "title": "The Condition of the Working Class in England",
  "author_ids": [
    "engels-friedrich"
  ],
  "year": 1845,
  "kind": "book",
  "source": {
    "provider": "Marxists Internet Archive",
    "url": "https://www.marxists.org/archive/marx/works/1845/condition-working-class/",
    "attribution_label": "Friedrich Engels, The Condition of the Working Class in England (Marxists.org)"
  }
}