{
  "id": "bukharin-imperialism-and-world-economy",
  "title": "Imperialism and World Economy",
  "author_ids": [
    "bukharin"
  ],
  "year": 1917,
  "kind": "book",
  "source": {
    "provider": "Marxists Internet Archive",
    "url": "https://www.marxists.org/archive/bukharin/works/1917/imperial/",
    "attribution_label": "Bukharin, Imperialism and World Economy (Marxists.org)"
  }
}