{
  "id": "lenin-derecho-naciones",
  "title": "El derecho de las naciones a la autodeterminación",
  "author_ids": [
    "lenin-vi"
  ],
  "year": 1914,
  "kind": "article",
  "source": {
    "provider": "Marxists.org",
    "url": "https://www.marxists.org/espanol/lenin/obras/1910s/dernauto.htm",
    "attribution_label": "Lenin, V. I. El derecho de las naciones a la autodeterminación (1914). Marxists.org."
  }
}
