{
  "id": "lenin-izquierdismo",
  "title": "El «izquierdismo», enfermedad infantil del comunismo",
  "author_ids": [
    "lenin-vi"
  ],
  "year": 1920,
  "kind": "pamphlet",
  "source": {
    "provider": "Marxists.org",
    "url": "https://www.marxists.org/espanol/lenin/obras/1920s/izquier.htm",
    "attribution_label": "Lenin, V. I. El «izquierdismo», enfermedad infantil del comunismo (1920). Marxists.org."
  }
}
